<?xml version="1.0" encoding="UTF-8"?>
<!DOCTYPE hibernate-reverse-engineering SYSTEM "http://hibernate.sourceforge.net/hibernate-reverse-engineering-3.0.dtd" >

<hibernate-reverse-engineering>

	<type-mapping>
		<sql-type jdbc-type="BINARY" length="1" hibernate-type="boolean" />
		<sql-type jdbc-type="INTEGER" length="5" hibernate-type="int" />		
		<sql-type jdbc-type="INTEGER" hibernate-type="long" />				
		<sql-type jdbc-type="BIGINT" precision="5" hibernate-type="byte[]" />				
		<sql-type jdbc-type="BIGINT" hibernate-type="java.math.BigInteger" />		
		<sql-type jdbc-type="CHAR"   hibernate-type="string" />
   
        <!-- start HBX-534 -->
		<sql-type jdbc-type="NUMERIC" precision='10' scale="0" hibernate-type="Long" />
		<sql-type jdbc-type="NUMERIC" precision='10' hibernate-type="java.lang.Long" />
        <!-- end HBX-534 -->
        
        <!--  nullability -->
        <sql-type jdbc-type="FLOAT" scale="17" not-null="true" hibernate-type="nonnull-float" />
        <sql-type jdbc-type="FLOAT" scale="17" not-null="false" hibernate-type="null-float" />
        <sql-type jdbc-type="FLOAT" not-null="true" hibernate-type="onlynotnull" /> 
        <sql-type jdbc-type="FLOAT" hibernate-type="donotcare" /> 
		
        
	</type-mapping>

</hibernate-reverse-engineering>